CREATE EXTENSION pg_sorted_heap;
-- SH-HNSW: sorted_hnsw Index AM tests
SET client_min_messages = warning;
-- Same-session interaction: run a sorted_heap custom scan before HNSW
CREATE TABLE sh_combo (id int PRIMARY KEY, note text) USING sorted_heap;
INSERT INTO sh_combo
SELECT i, repeat('x', 10)
FROM generate_series(1, 5000) AS i;
SELECT sorted_heap_compact('sh_combo'::regclass);
 sorted_heap_compact 
---------------------
 
(1 row)

ANALYZE sh_combo;
SET enable_indexscan = off;
SET enable_bitmapscan = off;
EXPLAIN (COSTS OFF)
SELECT note FROM sh_combo WHERE id = 42;
                QUERY PLAN                
------------------------------------------
 Custom Scan (SortedHeapScan) on sh_combo
   Filter: (id = 42)
   Zone Map: 1 of 29 blocks (pruned 28)
(3 rows)

RESET enable_indexscan;
RESET enable_bitmapscan;
DROP TABLE sh_combo;
CREATE TABLE hnsw_test (id serial PRIMARY KEY, v svec(4));
INSERT INTO hnsw_test (v)
SELECT format('[%s,%s,%s,%s]',
  round((sin(id * 1.0))::numeric, 4),
  round((cos(id * 1.0))::numeric, 4),
  round((sin(id * 2.0))::numeric, 4),
  round((cos(id * 2.0))::numeric, 4))::svec
FROM generate_series(1, 100) AS id;
CREATE INDEX hnsw_test_idx ON hnsw_test USING sorted_hnsw (v) WITH (m = 16, ef_construction = 64);
SET client_min_messages = notice;
SELECT pg_relation_size('hnsw_test_idx') > 0 AS hnsw_index_exists;
 hnsw_index_exists 
-------------------
 t
(1 row)

SET enable_seqscan = off;
SET sorted_hnsw.ef_search = 32;
DO $$ BEGIN PERFORM sorted_hnsw_reset_stats(); END $$;
CREATE FUNCTION hnsw_plan_contains(query text, pattern text) RETURNS boolean AS $$
DECLARE
  r record;
BEGIN
  FOR r IN EXECUTE 'EXPLAIN (COSTS OFF) ' || query LOOP
    IF r."QUERY PLAN" LIKE '%' || pattern || '%' THEN
      RETURN true;
    END IF;
  END LOOP;
  RETURN false;
END;
$$ LANGUAGE plpgsql;
SELECT count(*) AS hnsw_result_count FROM (
  SELECT id FROM hnsw_test ORDER BY v <=> '[0.8,0.6,0.9,0.1]'::svec LIMIT 5
) x;
 hnsw_result_count 
-------------------
                 5
(1 row)

COPY (
  SELECT sorted_hnsw_scan_stats() LIKE
         'calls=% l0_searches=% topup_searches=% exact_fallbacks=% exact_fallback_wins=% last={ef=%,nodes=%,l0_candidates=%,initial_results=%,topup_ef=%,topup_candidates=%,topup_results=%,fallback_results=%,final_results=%,exact_fallback=%}' AS hnsw_scan_stats_shape
) TO STDOUT;
t
-- Self-query
SELECT round(min(v <=> (SELECT v FROM hnsw_test WHERE id = 1))::numeric, 6) AS self_dist FROM (
  SELECT v FROM hnsw_test ORDER BY v <=> (SELECT v FROM hnsw_test WHERE id = 1) LIMIT 5
) x;
 self_dist 
-----------
  0.000000
(1 row)

SET sorted_heap.hnsw_ef_patience = 4;
SELECT round(min(v <=> (SELECT v FROM hnsw_test WHERE id = 1))::numeric, 6) AS self_dist_patience FROM (
  SELECT v FROM hnsw_test ORDER BY v <=> (SELECT v FROM hnsw_test WHERE id = 1) LIMIT 5
) x;
 self_dist_patience 
--------------------
           0.000000
(1 row)

RESET sorted_heap.hnsw_ef_patience;
-- Planner guard: automatic index path is only valid for LIMIT <= ef_search
RESET enable_seqscan;
EXPLAIN (COSTS OFF)
SELECT id FROM hnsw_test ORDER BY v <=> '[0.8,0.6,0.9,0.1]'::svec;
                   QUERY PLAN                    
-------------------------------------------------
 Sort
   Sort Key: ((v <=> '[0.8,0.6,0.9,0.1]'::svec))
   ->  Seq Scan on hnsw_test
(3 rows)

EXPLAIN (COSTS OFF)
SELECT id FROM hnsw_test ORDER BY v <=> '[0.8,0.6,0.9,0.1]'::svec LIMIT 40;
                      QUERY PLAN                       
-------------------------------------------------------
 Limit
   ->  Sort
         Sort Key: ((v <=> '[0.8,0.6,0.9,0.1]'::svec))
         ->  Seq Scan on hnsw_test
(4 rows)

EXPLAIN (COSTS OFF)
SELECT id FROM hnsw_test WHERE id > 10 ORDER BY v <=> '[0.8,0.6,0.9,0.1]'::svec LIMIT 5;
                      QUERY PLAN                       
-------------------------------------------------------
 Limit
   ->  Sort
         Sort Key: ((v <=> '[0.8,0.6,0.9,0.1]'::svec))
         ->  Seq Scan on hnsw_test
               Filter: (id > 10)
(5 rows)

SELECT NOT hnsw_plan_contains(
  'SELECT id FROM hnsw_test ORDER BY v <=> ''[0.8,0.6,0.9,0.1]''::svec',
  'hnsw_test_idx') AS hnsw_guard_unbounded_no_index;
 hnsw_guard_unbounded_no_index 
-------------------------------
 t
(1 row)

SELECT NOT hnsw_plan_contains(
  'SELECT id FROM hnsw_test ORDER BY v <=> ''[0.8,0.6,0.9,0.1]''::svec LIMIT 40',
  'hnsw_test_idx') AS hnsw_guard_limit_gt_ef_no_index;
 hnsw_guard_limit_gt_ef_no_index 
---------------------------------
 t
(1 row)

SELECT NOT hnsw_plan_contains(
  'SELECT id FROM hnsw_test WHERE id > 10 ORDER BY v <=> ''[0.8,0.6,0.9,0.1]''::svec LIMIT 5',
  'hnsw_test_idx') AS hnsw_guard_filter_no_index;
 hnsw_guard_filter_no_index 
----------------------------
 t
(1 row)

SET enable_seqscan = off;
-- Partition-aware helper: route selected leaves, run local sorted_hnsw KNN,
-- then exact-rerank the global candidate pool.
SET client_min_messages = warning;
CREATE TABLE hnsw_part(bucket int, id int, v svec(4), payload text,
                       PRIMARY KEY(bucket, id))
PARTITION BY RANGE(bucket);
CREATE TABLE hnsw_part_1 PARTITION OF hnsw_part
    FOR VALUES FROM (1) TO (2) USING sorted_heap;
CREATE TABLE hnsw_part_2 PARTITION OF hnsw_part
    FOR VALUES FROM (2) TO (3) USING sorted_heap;
INSERT INTO hnsw_part
SELECT 1, g, format('[1,%s,0,0]', round((g / 10000.0)::numeric, 4))::svec, 'a'
FROM generate_series(1, 40) g;
INSERT INTO hnsw_part
SELECT 2, g, format('[0,1,%s,0]', round((g / 10000.0)::numeric, 4))::svec, 'b'
FROM generate_series(1, 40) g;
SELECT count(*) AS part_compact_ok
FROM sorted_heap_compact_partitions('hnsw_part'::regclass)
WHERE status = 'ok';
 part_compact_ok 
-----------------
               2
(1 row)

CREATE INDEX hnsw_part_1_v_idx ON hnsw_part_1 USING sorted_hnsw (v) WITH (m = 8, ef_construction = 32);
CREATE INDEX hnsw_part_2_v_idx ON hnsw_part_2 USING sorted_hnsw (v) WITH (m = 8, ef_construction = 32);
ANALYZE hnsw_part;
SET client_min_messages = notice;
SET sorted_hnsw.ef_search = 8;
SELECT count(*) AS part_search_count
FROM sorted_hnsw_partition_search('hnsw_part'::regclass, 'v', '[1,0,0,0]', 5);
 part_search_count 
-------------------
                 5
(1 row)

SELECT array_agg(DISTINCT leaf_name ORDER BY leaf_name) AS part_selected_leaf
FROM sorted_hnsw_partition_search(
    'hnsw_part'::regclass, 'v', '[1,0,0,0]', 5, 5,
    ARRAY['hnsw_part_2'::regclass]);
 part_selected_leaf 
--------------------
 {hnsw_part_2}
(1 row)

SELECT bool_and((row_data->>'bucket')::int = 2) AS part_selected_bucket_ok
FROM sorted_hnsw_partition_search(
    'hnsw_part'::regclass, 'v', '[1,0,0,0]', 5, 5,
    ARRAY['hnsw_part_2'::regclass]);
 part_selected_bucket_ok 
-------------------------
 t
(1 row)

COPY (
SELECT count(*)
FROM sorted_hnsw_partition_search(
    'hnsw_part'::regclass, 'v', '[1,0,0,0]', 5, 5,
    ARRAY[]::regclass[])
) TO STDOUT;
0
SELECT requested_top_k, effective_local_k, selected_leaves,
       returned_rows, underfilled, fallback
FROM sorted_hnsw_partition_search_status(
    'hnsw_part'::regclass, 'v', '[1,0,0,0]', 5, 5,
    ARRAY['hnsw_part_2'::regclass]);
 requested_top_k | effective_local_k | selected_leaves | returned_rows | underfilled | fallback 
-----------------+-------------------+-----------------+---------------+-------------+----------
               5 |                 5 |               1 |             5 | f           | none
(1 row)

CREATE TABLE hnsw_part_3 PARTITION OF hnsw_part
    FOR VALUES FROM (3) TO (4) USING sorted_heap;
INSERT INTO hnsw_part
SELECT 3, g, format('[1,%s,0,0]', round((g / 10000.0)::numeric, 4))::svec, 'c'
FROM generate_series(1, 2) g;
SELECT sorted_heap_compact('hnsw_part_3'::regclass);
NOTICE:  sorted_heap_compact acquires AccessExclusiveLock
HINT:  Schedule during maintenance windows. Concurrent reads and writes are blocked.
 sorted_heap_compact 
---------------------
 
(1 row)

SET client_min_messages = warning;
CREATE INDEX hnsw_part_3_v_idx ON hnsw_part_3 USING sorted_hnsw (v) WITH (m = 8, ef_construction = 32);
SET client_min_messages = notice;
SELECT requested_top_k, effective_local_k, selected_leaves,
       returned_rows, underfilled, fallback
FROM sorted_hnsw_partition_search_status(
    'hnsw_part'::regclass, 'v', '[1,0,0,0]', 5, 5,
    ARRAY['hnsw_part_3'::regclass]);
 requested_top_k | effective_local_k | selected_leaves | returned_rows | underfilled |        fallback         
-----------------+-------------------+-----------------+---------------+-------------+-------------------------
               5 |                 5 |               1 |             2 | t           | underfilled_no_fallback
(1 row)

COPY (
  SELECT requested_top_k, effective_local_k, selected_leaves,
         returned_rows, underfilled, fallback
  FROM sorted_hnsw_partition_search_status(
      'hnsw_part'::regclass, 'v', '[1,0,0,0]', 5, 5,
      ARRAY['hnsw_part_3'::regclass],
      true,
      true)
) TO STDOUT;
5	5	1	2	t	exact_filtered
COPY (
  SELECT count(*) AS part_exact_fallback_count
  FROM sorted_hnsw_partition_search(
      'hnsw_part'::regclass, 'v', '[1,0,0,0]', 5, 5,
      ARRAY['hnsw_part_3'::regclass],
      true,
      true)
) TO STDOUT;
2
CREATE TABLE hnsw_part_not_leaf(id int PRIMARY KEY, v svec(4)) USING sorted_heap;
DO $$
BEGIN
  PERFORM *
  FROM sorted_hnsw_partition_search(
      'hnsw_part'::regclass, 'v', '[1,0,0,0]', 5, 5,
      ARRAY['hnsw_part_not_leaf'::regclass]);
  RAISE EXCEPTION 'expected sorted_hnsw_partition_search to reject non-child selected leaf';
EXCEPTION WHEN OTHERS THEN
  IF SQLERRM NOT LIKE 'selected leaf % is not a leaf of partition parent %' THEN
    RAISE;
  END IF;
END;
$$;
DROP TABLE hnsw_part_not_leaf;
DROP INDEX hnsw_part_2_v_idx;
DO $$
BEGIN
  PERFORM *
  FROM sorted_hnsw_partition_search(
      'hnsw_part'::regclass, 'v', '[1,0,0,0]', 5, 5,
      ARRAY['hnsw_part_2'::regclass]);
  RAISE EXCEPTION 'expected sorted_hnsw_partition_search to reject a leaf without sorted_hnsw index';
EXCEPTION WHEN OTHERS THEN
  IF SQLERRM NOT LIKE 'partition leaf % must have a valid sorted_hnsw index on column %' THEN
    RAISE;
  END IF;
END;
$$;
SET client_min_messages = warning;
CREATE INDEX hnsw_part_2_v_idx ON hnsw_part_2 USING sorted_hnsw (v) WITH (m = 8, ef_construction = 32);
SET client_min_messages = notice;
DO $$
BEGIN
  PERFORM *
  FROM sorted_hnsw_partition_search('hnsw_part'::regclass, 'v', '[1,0,0,0]', 5, 9);
  RAISE EXCEPTION 'expected sorted_hnsw_partition_search to reject local_k > ef_search';
EXCEPTION WHEN OTHERS THEN
  IF SQLERRM NOT LIKE 'local_k (%) must be <= sorted_hnsw.ef_search (%)' THEN
    RAISE;
  END IF;
END;
$$;
DROP TABLE hnsw_part;
SET sorted_hnsw.ef_search = 32;
SET client_min_messages = warning;
CREATE TABLE hnsw_part_half(bucket int, id int, v hsvec(4),
                            PRIMARY KEY(bucket, id))
PARTITION BY RANGE(bucket);
CREATE TABLE hnsw_part_half_1 PARTITION OF hnsw_part_half
    FOR VALUES FROM (1) TO (2) USING sorted_heap;
INSERT INTO hnsw_part_half
SELECT 1, g, format('[1,%s,0,0]', round((g / 10000.0)::numeric, 4))::hsvec
FROM generate_series(1, 20) g;
SELECT count(*) AS part_hsvec_compact_ok
FROM sorted_heap_compact_partitions('hnsw_part_half'::regclass)
WHERE status = 'ok';
 part_hsvec_compact_ok 
-----------------------
                     1
(1 row)

CREATE INDEX hnsw_part_half_1_v_idx ON hnsw_part_half_1 USING sorted_hnsw (v hsvec_cosine_ops) WITH (m = 8, ef_construction = 32);
SET client_min_messages = notice;
SET sorted_hnsw.ef_search = 8;
SELECT count(*) AS part_hsvec_count
FROM sorted_hnsw_partition_search('hnsw_part_half'::regclass, 'v', '[1,0,0,0]', 3);
 part_hsvec_count 
------------------
                3
(1 row)

DROP TABLE hnsw_part_half;
SET sorted_hnsw.ef_search = 32;
-- Dead heap tuples before VACUUM: top-up must still fill LIMIT K
CREATE TABLE hnsw_dead (id int PRIMARY KEY, v svec(4));
INSERT INTO hnsw_dead
SELECT i,
       CASE
         WHEN i <= 20
           THEN format('[1,%s,0,0]', round((i / 1000.0)::numeric, 3))
         ELSE format('[0,1,%s,0]', round(((i - 20) / 1000.0)::numeric, 3))
       END::svec
FROM generate_series(1, 40) AS i;
SET client_min_messages = warning;
CREATE INDEX hnsw_dead_idx ON hnsw_dead USING sorted_hnsw (v) WITH (m = 16, ef_construction = 64);
SET client_min_messages = notice;
SET sorted_hnsw.ef_search = 8;
DELETE FROM hnsw_dead WHERE id BETWEEN 1 AND 10;
SELECT count(*) AS dead_topup_count FROM (
  SELECT id FROM hnsw_dead ORDER BY v <=> '[1,0,0,0]'::svec LIMIT 5
) x;
 dead_topup_count 
------------------
                5
(1 row)

DROP TABLE hnsw_dead;
SET sorted_hnsw.ef_search = 32;
-- Dead-heavy churn after VACUUM: stale graph entry points must not make a
-- live table look empty. This models app-level reindexing that deletes old
-- chunks and inserts fresh chunks without rebuilding the ANN index.
CREATE TABLE hnsw_dead_churn (id serial PRIMARY KEY, v svec(4));
INSERT INTO hnsw_dead_churn (v)
SELECT format('[1,%s,0,0]', round((i / 1000.0)::numeric, 3))::svec
FROM generate_series(1, 200) AS i;
SET client_min_messages = warning;
CREATE INDEX hnsw_dead_churn_idx ON hnsw_dead_churn USING sorted_hnsw (v) WITH (m = 2, ef_construction = 8);
SET client_min_messages = notice;
DELETE FROM hnsw_dead_churn;
VACUUM hnsw_dead_churn;
INSERT INTO hnsw_dead_churn (v)
SELECT format('[1,%s,0,0]', round((i / 1000.0)::numeric, 3))::svec
FROM generate_series(1, 5) AS i;
SET sorted_hnsw.ef_search = 4;
COPY (
  SELECT count(*) = 4 AS dead_churn_fallback_ok FROM (
    SELECT id FROM hnsw_dead_churn ORDER BY v <=> '[1,0,0,0]'::svec LIMIT 4
  ) x
) TO STDOUT;
t
DROP TABLE hnsw_dead_churn;
SET sorted_hnsw.ef_search = 32;
-- DELETE + VACUUM
DELETE FROM hnsw_test WHERE id BETWEEN 1 AND 5;
VACUUM hnsw_test;
SELECT count(*) AS after_delete FROM (
  SELECT id FROM hnsw_test ORDER BY v <=> '[0.8,0.6,0.9,0.1]'::svec LIMIT 5
) x;
 after_delete 
--------------
            5
(1 row)

-- INSERT after build
INSERT INTO hnsw_test (v) VALUES ('[0.8,0.6,0.9,0.1]');
SELECT count(*) AS total_after_insert FROM hnsw_test;
 total_after_insert 
--------------------
                 96
(1 row)

-- Same-session scan cache must see the new exact vector immediately
SELECT round(min(v <=> '[0.8,0.6,0.9,0.1]'::svec)::numeric, 6) AS exact_after_insert FROM (
  SELECT v FROM hnsw_test ORDER BY v <=> '[0.8,0.6,0.9,0.1]'::svec LIMIT 1
) x;
 exact_after_insert 
--------------------
           0.000000
(1 row)

-- Repeated same-session inserts must keep cached neighbor pointers valid
INSERT INTO hnsw_test (v)
SELECT format('[0.8,0.6,0.9,%s]', round((g / 100.0)::numeric, 2))::svec
FROM generate_series(11, 26) AS g;
SELECT round(min(v <=> '[0.8,0.6,0.9,0.1]'::svec)::numeric, 6) AS exact_after_many_inserts FROM (
  SELECT v FROM hnsw_test ORDER BY v <=> '[0.8,0.6,0.9,0.1]'::svec LIMIT 1
) x;
 exact_after_many_inserts 
--------------------------
                 0.000000
(1 row)

-- REINDEX must invalidate cached graph state via relfilenode/cache_gen
SET client_min_messages = warning;
REINDEX INDEX hnsw_test_idx;
SET client_min_messages = notice;
COPY (
  SELECT (round(min(v <=> '[0.8,0.6,0.9,0.1]'::svec)::numeric, 6) = 0::numeric) AS exact_after_reindex_ok FROM (
    SELECT v FROM hnsw_test ORDER BY v <=> '[0.8,0.6,0.9,0.1]'::svec LIMIT 1
  ) x
) TO STDOUT;
t
-- Query after DML
SELECT count(*) AS query_after_dml FROM (
  SELECT id FROM hnsw_test ORDER BY v <=> '[0.8,0.6,0.9,0.1]'::svec LIMIT 5
) x;
 query_after_dml 
-----------------
               5
(1 row)

-- Empty index bootstrap: first INSERT must materialize the first node
SET client_min_messages = warning;
CREATE TABLE hnsw_empty (id serial PRIMARY KEY, v svec(4));
CREATE INDEX hnsw_empty_idx ON hnsw_empty USING sorted_hnsw (v) WITH (m = 16, ef_construction = 64);
INSERT INTO hnsw_empty (v) VALUES ('[1,0,0,0]');
SELECT count(*) AS empty_after_insert FROM hnsw_empty;
 empty_after_insert 
--------------------
                  1
(1 row)

SELECT count(*) AS empty_query_count FROM (
  SELECT id FROM hnsw_empty ORDER BY v <=> '[1,0,0,0]'::svec LIMIT 1
) x;
 empty_query_count 
-------------------
                 1
(1 row)

-- Low-memory SQ8 build path
SET sorted_hnsw.build_sq8 = on;
CREATE TABLE hnsw_buildsq8 (id serial PRIMARY KEY, v svec(4));
INSERT INTO hnsw_buildsq8 (v)
SELECT format('[%s,%s,%s,%s]',
  round((sin(id * 1.0))::numeric, 4),
  round((cos(id * 1.0))::numeric, 4),
  round((sin(id * 2.0))::numeric, 4),
  round((cos(id * 2.0))::numeric, 4))::svec
FROM generate_series(1, 80) AS id;
CREATE INDEX hnsw_buildsq8_idx ON hnsw_buildsq8 USING sorted_hnsw (v) WITH (m = 16, ef_construction = 64);
COPY (
  SELECT count(*) AS buildsq8_result_count FROM (
    SELECT id FROM hnsw_buildsq8 ORDER BY v <=> '[0.8,0.6,0.9,0.1]'::svec LIMIT 5
  ) x
) TO STDOUT;
5
COPY (
  SELECT round(min(v <=> (SELECT v FROM hnsw_buildsq8 WHERE id = 1))::numeric, 6) AS buildsq8_self_dist FROM (
    SELECT v FROM hnsw_buildsq8 ORDER BY v <=> (SELECT v FROM hnsw_buildsq8 WHERE id = 1) LIMIT 5
  ) x
) TO STDOUT;
0.000000
DROP TABLE hnsw_buildsq8;
RESET sorted_hnsw.build_sq8;
-- Native hsvec path: no upcasted storage contract
CREATE TABLE hnsw_half (id serial PRIMARY KEY, v hsvec(4));
INSERT INTO hnsw_half (v)
SELECT format('[%s,%s,%s,%s]',
  round((sin(id * 1.0))::numeric, 4),
  round((cos(id * 1.0))::numeric, 4),
  round((sin(id * 2.0))::numeric, 4),
  round((cos(id * 2.0))::numeric, 4))::hsvec
FROM generate_series(1, 80) AS id;
CREATE INDEX hnsw_half_idx ON hnsw_half USING sorted_hnsw (v hsvec_cosine_ops) WITH (m = 16, ef_construction = 64);
SELECT count(*) AS hsvec_result_count FROM (
  SELECT id FROM hnsw_half ORDER BY v <=> '[0.8,0.6,0.9,0.1]'::hsvec LIMIT 5
) x;
 hsvec_result_count 
--------------------
                  5
(1 row)

SELECT round(min(v <=> (SELECT v FROM hnsw_half WHERE id = 1))::numeric, 6) AS hsvec_self_dist FROM (
  SELECT v FROM hnsw_half ORDER BY v <=> (SELECT v FROM hnsw_half WHERE id = 1) LIMIT 5
) x;
 hsvec_self_dist 
-----------------
        0.000000
(1 row)

EXPLAIN (COSTS OFF)
SELECT id FROM hnsw_half ORDER BY v <=> '[0.8,0.6,0.9,0.1]'::hsvec LIMIT 5;
                                    QUERY PLAN                                    
----------------------------------------------------------------------------------
 Limit
   ->  Index Scan using hnsw_half_idx on hnsw_half
         Order By: (v <=> '[0.7998047,0.60009766,0.89990234,0.099975586]'::hsvec)
(3 rows)

RESET enable_seqscan;
RESET sorted_hnsw.ef_search;
DROP FUNCTION hnsw_plan_contains(text, text);
DROP TABLE hnsw_half;
DROP TABLE hnsw_empty;
DROP TABLE hnsw_test;
DROP EXTENSION pg_sorted_heap;
